name	last_modified	st_size
Downtown no Gaki no Tsukai ya Arahende!! - 05-24-15 (NTV).ass	2015-05-27T15:42:36Z	84559
Downtown no Gaki no Tsukai ya Arahende!! - 05-31-15 (NTV).ass	2015-05-31T15:45:29Z	73341
Downtown no Gaki no Tsukai ya Arahende!! - 06-07-15 (NTV).ass	2015-06-14T15:45:47Z	59036
Downtown no Gaki no Tsukai ya Arahende!! - 06-14-15 (NTV).ass	2015-06-14T15:46:03Z	70009
Downtown no Gaki no Tsukai ya Arahende!! - 06-21-15 (NTV).ass	2015-06-21T15:25:44Z	70894
Downtown no Gaki no Tsukai ya Arahende!! - 06-28-15 (NTV).ass	2015-06-28T16:21:31Z	73334
Downtown no Gaki no Tsukai ya Arahende!! - 07-05-15 (NTV).ass	2015-07-05T21:39:48Z	70707
Downtown no Gaki no Tsukai ya Arahende!! - 07-13-15 (NTV).ass	2015-07-12T15:24:56Z	54006
Downtown no Gaki no Tsukai ya Arahende!! - 07-19-15 (NTV).ass	2015-07-19T15:23:40Z	79890
Downtown no Gaki no Tsukai ya Arahende!! - 07-26-15 (NTV).ass	2015-07-26T15:16:34Z	81854
Downtown no Gaki no Tsukai ya Arahende!! - 08-02-15 (NTV).ass	2015-08-02T17:31:46Z	77288
Downtown no Gaki no Tsukai ya Arahende!! - 08-09-15 (NTV).ass	2015-08-09T15:27:44Z	74914
Downtown no Gaki no Tsukai ya Arahende!! - 08-16-15 (NTV).ass	2015-08-16T18:09:26Z	79135
Downtown no Gaki no Tsukai ya Arahende!! - 08-23-15 (NTV).ass	2015-08-23T16:32:37Z	82924
Downtown no Gaki no Tsukai ya Arahende!! - 08-30-15 (NTV).ass	2015-08-31T11:27:48Z	67948
Downtown no Gaki no Tsukai ya Arahende!! - 09-06-15 (NTV).ass	2015-09-06T16:52:42Z	78459
Downtown no Gaki no Tsukai ya Arahende!! - 09-13-15 (NTV).ass	2015-09-19T21:02:32Z	87884
Downtown no Gaki no Tsukai ya Arahende!! - 09-27-15 (NTV).ass	2015-09-27T20:45:05Z	89196
Downtown no Gaki no Tsukai ya Arahende!! [05-24-15 - 09-27-15].zip	2024-03-03T12:25:05Z	246401
